<?xml version="1.0" encoding="UTF-8"?>

<book xmlns:xsi="http://www.w3.org/2001/XMLSchema-instance" xsi:noNamespaceSchemaLocation="bookChar.xsd" isbn="9766332625">
 <title>  Being a Dog Is a Full-Time Job </title>
 <author>Charles M. Schulz</author>
 <character>
	  <name>Snoopy</name>
	  <friend-of>Peppermint Patty</friend-of>
	  <since>1950-10-04</since>
	  <qualification>extroverted beagle</qualification>
 </character>
 <character>
	  <name>Peppermint Patty</name>
	  <since>1966-08-22</since>
	  <friend-of>xyz</friend-of>
	  <qualification>bold, brash and tomboyish</qualification>
 </character>
</book>
